{
  "version": "1.0",
  "centers": [
    "Sevilla",
    "Córdoba"
  ],
  "courses": [
    "4.º Primaria",
    "5.º Primaria",
    "6.º Primaria",
    "1.º ESO",
    "2.º ESO",
    "3.º ESO",
    "4.º ESO",
    "1.º Bachillerato",
    "2.º Bachillerato"
  ],
  "groups": [
    "A",
    "B",
    "C"
  ],
  "dataColumns": [
    "ID",
    "Campus",
    "Curso",
    "Grupo",
    "Tratamiento",
    "popularidad",
    "sociabilidad",
    "reciprocidad_amistad",
    "acierto_amistad",
    "rechazo_recibido",
    "rechazo_declarado",
    "reciprocidad_rechazo",
    "acierto_rechazo",
    "bienestar",
    "centralidad",
    "mediacion",
    "amistad_recibida_n",
    "amistad_declarada_n",
    "amistad_reciproca_n",
    "rechazo_recibido_n",
    "rechazo_declarado_n",
    "rechazo_reciproco_n",
    "bienestar_suma",
    "mediacion_n",
    "mediacion_negativa_n",
    "bullying_companeros_n",
    "bullying_autorreporte",
    "respondio",
    "soledad_frecuente",
    "identifica_apoyo",
    "comunidad_amistad",
    "escala_indicadores",
    "n_clase",
    "pred_amistad_n",
    "pred_amistad_aciertos",
    "pred_rechazo_n",
    "pred_rechazo_aciertos",
    "centralidad_eigenvector"
  ],
  "groupColumns": [
    "Campus",
    "Curso",
    "Grupo",
    "Periodo",
    "salones_referencia",
    "pos_bullying_declarado",
    "pos_bullying_companeros",
    "pos_soledad",
    "pos_densidad_rechazo",
    "pos_sin_reciprocas",
    "pos_separacion",
    "pos_desigualdad",
    "pos_centralizacion",
    "modularidad",
    "gini_popularidad",
    "centralizacion_eigenvector",
    "escala_grupo"
  ],
  "keyColumns": [
    "ID",
    "Nombre"
  ],
  "profileColumns": [
    "usuario",
    "clave",
    "rol",
    "centro",
    "curso",
    "grupo",
    "nombre"
  ],
  "scale": "normalizada_v1"
}
